By 2021, about 380 million cars on the road will be connected to the internet.|Forecast
Of the 245,000 people who work under the departments umbrella, nearly 213,000 have been deemed essential, according to the departments contingency plan.|Non-Forecast
Composters work best in full sun since they yield the best results at high temperatures.|Non-Forecast
The steep slide in the stock market will likely break apart the popularity of investing in the stocks as a single trade, he said. |Non-Forecast
The liberal Left continue to push their radical agenda against American values. |Non-Forecast
U.S. Colleges can expect fewer new regulations coming from the Department of Education over the next few years.|Forecast
A failure of a superregional critical infrastructure facility could cause large-scale effects.|Forecast
Developers will be able to build Siri integration into their apps.|Forecast
You will also become more organized because avoiding single-use plastic requires a plan.|Non-Forecast
Better yet, dont use a compost bin at all, but just create a loose pile.|Non-Forecast
Cannabis company shares were up sharply at midday in Tel Aviv.|Non-Forecast
Russia will lift trade sanctions and accelerate plans to assist Turkey in constructing the countrys first nuclear power plant.|Forecast
The specific future of packaging design to 2021 and 2026 is predicted to be determined by supply side technological trends and demand side consumer trends.|Forecast
It dropped the lawsuit in 2015 after the Air Force agreed to open up competition.|Non-Forecast
A confrontation between generations in the labor market and the weakening of democracy are the key risks associated with longer life expectancy.|Forecast
The planned withdrawal was widely criticized, even by senior Republicans in Congress.|Non-Forecast
Satellite images could help monitor remote, vulnerable archaeological sites.|Non-Forecast
Samsung moved many tens of thousands of jobs to Vietnam from China years ago.|Non-Forecast
Greater integration of Americas health care and housing systems will be essential to improve health outcomes for older adults and enable millions of Americans to age in place in their own homes and communities.|Forecast
The UK government has informally banned smartwatches from high-profile meetings out of concern that foreign powers could use them to eavesdrop.|Forecast
During that time, the proportion of patients with opioid abuse problems surged eight-fold, from 0.06 percent to 0.54 percent.|Non-Forecast
Content created by The Daily Caller News Foundation is available without charge to any eligible news publisher that can provide a large audience. |Non-Forecast
Its not pretty.|Non-Forecast
The new findings by NASA worryingly indicate that the Phytoplankton species boom and bust population is heavily threatened by melting ice-caps caused by global warming.|Forecast
What Singles Day can tell us about how retail is changing in China.|Non-Forecast
Current authentication technologies could revolutionize the act of voting well beyond simply choosing candidates every two to four years.|Forecast
Iraq will not be included in the list of countries whose citizens will banned from the US.|Forecast
And indeed, nearly all of those surveyed agreed physical activity is good for health.|Non-Forecast
The militia groups that first liberated the Libyan city of Sirte from the Islamic State are now posing a major threat to the fragile internationally recognized Libyan government.|Forecast
Find one or two paper plates that you can place between your body and the floor (or wall) as prescribed. |Non-Forecast
You do get more for paying more; the customization options and build quality exceed what youll find at places like Disneylands own build your own lightsaber stations. |Non-Forecast
In some cases, hitting corporate zero waste targets means changing perspectives on waste from the boardroom to the manufacturing floor.|Non-Forecast
The ever-expanding power of finance directors is a direct threat to the CIO role.|Forecast
If youve been loaning a family member your Netflix username and password for months, break that dependence and help them start their own account. |Non-Forecast
Shifting regulations and corruption are holding foreign investment at bay.7 Persistent inability to accommodate international investment could be a sign that India is continuing with Scenario 1 or even headed for Scenario 2.|Forecast
Division of a state into more than one entity could send mini-shocks through the system if it were interpreted as yet another signal of fissures in US society-on top of divisive debates about budgets, the debt ceiling, and other issues.|Forecast
High-profile digital ethics failures will create new governing bodies, new regulations and a new category of jobs.|Forecast
The sound is well-balanced, and they feature extra comfortable memory foam ear pads.|Non-Forecast
Thousands of residents were forced to evacuate to higher ground. |Non-Forecast
Japan exploited that loophole, sending large vessels to the Antarctic that killed hundreds of whales annually, with their meat ending up for sale in Japan.|Non-Forecast
 It will be a year for prudent conservatism in many areas, combined with a readiness to make big, bold bets if and when one-time opportunities arise.|Non-Forecast
Frances dire economic prospects will see it fall from the worlds 5th to 9th largest economy by 2030.|Forecast
Uncertainty caused by the EU/Brexit referendum and weaker consumer sentiment will result in two quiet years in the housing market, according to property firm Savills, with zero growth next year followed by a 2% rise in 2018.|Forecast
When you reduce or cut out meat from your diet, you might also have lower stores of minerals that are best absorbed from animal foods, like zinc and iron.|Non-Forecast
The aging population and advancement in medical process will extend to increase the market growth of the medical adhesives in several areas.|Forecast
Consumer Technology Association (CTA) forecasts sales of action cameras will reach a record high in 2016 break another record in 2017.|Forecast
More than 70 percent of IT organizations planning a private PaaS will deploy a container service (rather than PaaS framework software).|Forecast
Integration of AMI with smart devices is expected to provide growth opportunities for market in coming years.|Forecast
Companies will be wise to perform a complete assessment of the political and social climate of the market to minimize the risks.|Forecast
Central bank balance sheets will continue to expand.|Forecast
The world will invest $US28tn in renewable energy and energy efficiency in the next 20 years.|Forecast
Our clinical experience is that with rapid tapers the healthcare costs go up due to excessive use of other costly services like emergency rooms and spine specialists.|Non-Forecast
Tsunami height forecasts were issued 3, 28, 44, and 90 minutes after the earthquake, with earlier forecasts underestimating the wave height, the research team writes in the journal Injury Prevention.|Non-Forecast
This time of year is the most remarkable time of year to experience it because the snow against that red rock is just breathtaking, she said.|Non-Forecast
Activistsincluding the commissionare trying to destroy a man for thought crimes. |Non-Forecast
 The key to making it sustainable is to reuse it. |Non-Forecast
The Trump administration has embraced over 60 percent of The Heritage Foundations policy recommendations since his inauguration.|Non-Forecast
Neuromorphic computers could change (and enhance) surveillance.|Forecast
Another entity almost certain to come under congressional scrutiny is the Trump Foundation, a charity that the Trump family dissolved Tuesday after a lawsuit by the New York attorney generals office alleged the nonprofit helped Trumps campaign for president.|Non-Forecast
Ted Cruzs opposition to Obamacare.|Non-Forecast
Groundwater constitutes the  largest reservoir of freshwater in the world, accounting for over 97% of all  freshwaters available on earth (excluding glaciers and ice caps).|Forecast
In the U.S. UAS sales could top more than 2.8 million units in 2016.|Forecast
Allowing Heathrow to expand will create a serious obstacle to meeting the UKs commitments on climate change and reducing air pollution.|Forecast
The survey, which was conducted by the polling firm YouGov and commissioned by the Foundation for Liberty and American Greatness, a nonprofit devoted to restoring civics, showed that its not just younger Americans who have a dim view of our nation.|Non-Forecast
The federal government is in a partial shutdown after Senate Republicans failed to receive enough votes to pass a short-term spending bill Friday that included funding for a border wall.|Non-Forecast
Many are hoping Finlands energy plan will include a complete ban on coal by 2030.|Forecast
I think Gowdy meant to say Paul Ryan a modern day floundering fool.|Non-Forecast
Practically, entering Encounter Mode means the spacecraft is on its own now. With thousands of instructions loaded into its onboard computers, it has begun its delicate dance, 1 billion miles past Pluto.|Non-Forecast
U.S. President-elect Donald Trump has threatened to ban Muslims from entering the United States and championed anti-immigration policies.|Forecast
The UK government has mandated that all centrally funded work is to be undertaken using BIM by April 2016 and the Queensland government has stated that it will progressively implement the use of BIM into all major state infrastructure projects by 2023.|Forecast
Recent foreign investments in agriculture in downstream Danube countries are expected to increase pollution pressure over the next few years.|Forecast
The big question thats dogged drilling proponents is how much oil and gas is in the Arctic National Wildlife Refuge.|Non-Forecast
The UN17 Village showcases how we can decouple growth from emissions by looking at waste as a resource, and by making sustainability and growth support each other without compromising on quality, aesthetics or price.|Non-Forecast
The ride treats you as a recruit to the Resistance who comes face to face with villain Kylo Ren.|Non-Forecast
A Russian subsidiary of OneWeb and Rosmoscos submitted a request for the frequency band last year, but it was rejected by the authorities.|Non-Forecast
By 2020, 60 percent of all enterprises will have fully articulated an organization-wide digital transformation strategy.|Forecast
Since then, problems ranging from Facebooks data privacy scandals to Apples declining iPhone sales to Netflixs rising cash burn rate have cratered the stocks, helping push the tech-heavy Nasdaq Composite index to the edge of a bear market. The Nasdaq lost another 1.7 percent in midday trading Friday.|Non-Forecast
Globally, radio advertising is forecast to grow 2.4% this year. Next year, Carat predicts radio will be flattish with 0.6% growth.|Forecast
Doctor moms regularly run up against discrimination, sometimes subtle and sometimes blatant, a new survey finds.|Non-Forecast
There is need for skill development to be tailored through problem-based learning that will increase youth employability in Nigeria.|Forecast
Companies will need a next-generation IT platform upon which they can build a digital core.|Forecast
500m will be wasted every year up to 2020 on apprenticeships that dont lead to a truly skilled job.|Forecast
Measures in the Trans-Pacific Partnership pushed by the Obama administrations negotiators will raise the price of many items by several thousand percent above the free market price.|Forecast
The implied value of the deal is $700 million, although the final number could vary based on how Small Giant performs.|Non-Forecast
Machine intelligence, artificial intelligence and cognitive computing are likely to become key components of business operations, says Gartner.|Forecast
Senegal will soon begin using a digital currency, ushering in the use of blockchain technology by the central bank.|Forecast
Although Spotify stands prominently, you can also buy gift cards to other music-streaming services. |Non-Forecast
The call did more to rattle markets than to assure them. |Non-Forecast
The video, just over two minutes long, includes previews of two flagship rides: Star Wars: Rise of the Resistance and Millennium Falcon: Smugglers Run.|Non-Forecast
Leadership, courage, and a vision of future Europe will be necessary for adequate opposition to the challenges imposed on Europe in democracy and security fields.|Forecast
Would you agree with that, Ben? Is that a good summation?|Non-Forecast
This dramatic drop in the use of capital punishment, along with the fact that executions are increasingly limited to a handful of outlier states, should have profound constitutional implications.|Non-Forecast
Business Intelligence tools, Predictive Analytics tools and Advanced Analytics Platforms will be pivotal to enabling industrial data analysis in the next five years.|Forecast
Pockets of northeast Nigeria controlled by the Islamist militant group and cut off from aid could be facing famine.|Forecast
Canadas household debt is projected to increase from 171 per cent of disposable income in the third quarter of 2015 to a high of 174 per cent in the third quarter of 2016.|Forecast
Global terrorism will continue to fail as a means of bringing about political change.|Forecast
The UK government will phase out the sale and manufacture of cosmetics and hygiene products that contain the tiny pieces of plastic by 2017.|Forecast
For the last few years, a team of Mexican physicists has been studying the physics of fluids at work in those techniques, concluding that the artists were intuitive physicists, using science to create timeless art.|Non-Forecast
These spaces are diverse in character and range from the classical plazas located around the metro stations to informal recreational park that forms the green heart of the new campus.|Non-Forecast
The good news is there is a solution. |Non-Forecast
Designed in collaboration with C.F. Mller Landscape, Transform, and Moe, the winning entry depicts an attractive, nature-filled campus centered on sustainable design features such as a recreational rainwater processing system.|Non-Forecast
The UK vote to leave the EU will have an impact on the London property market.|Forecast
Some of the lessons of India and certain other Asian markets will apply for emerging African countries.|Forecast
 Thus figuring out which APIs to build first requires mapping the most important journeys and then noting the required complementary APIs to unlock the needed data, cloud, and core resources.|Non-Forecast
We live in a rape culture, with systemic racism and systems of oppression inextricably tied to our institutions.|Non-Forecast
Zenith is predicting mobile advertising will overtake desktop in 2017, accounting for 52% of global internet advertising|Forecast
Researchers at the Lawrence Berkeley National Laboratory (Berkeley Lab) have built and trained machine-learning algorithms that can with high accuracy predict defect behavior in certain intermetallic compounds.|Forecast
In an aging world, Africa has the advantage of a young and growing population and will soon have the fastest urbanization rate in the world.|Forecast
It remains unclear what agreements, if any, have been reached with Turkey to ensure the enduring defeat of ISIS.|Non-Forecast
Small Giant has raised just under $50 million in venture capital funding and is backed by EQT Ventures.|Non-Forecast
Islamist insurgencies in the Middle East, North Africa, and possibly South Asia will likely make a determined grab for political power.|Forecast
All the fire ecologists are saying the same thing: You cant log your way out of this situation, Boggs told the Sacramento Bee. |Non-Forecast
 If they had discovered moons or rings near Ultima, NASA would have opted for a secondary flight path, with New Horizons course-correcting and flying past the object from a much greater distance.|Non-Forecast
Growing up in the 1980s, video games and comic books were part of the regular media diet for Americas youth.|Non-Forecast
America is the greatest Country in the world and my job is to fight for ALL citizens, even those who have made mistakes|Non-Forecast
That brings us back to the need for better messaging. |Non-Forecast
Algeria has begun a pilot shale gas well project and developed a 20-year investment plan to produce shale gas commercially by 2020.|Forecast
I am a mechanical watchmaking enthusiast and I am borrowing the term hacking from horology.|Non-Forecast
Global wine production expected to fall by 5% due to climatic events|Forecast
Patients are concerned about the small aspects of recovery, and we should be attuned to that.|Non-Forecast
This was also the case three and six months ago, but the gap between the two groups has shrunk.|Non-Forecast
Australias agricultural sector is set to reach $100 billion by 2030.|Forecast
Reduced foreign direct investment could amount to a 200 billion loss in the four years after the referendum if the UK voted to leave the EU.|Forecast
Regardless of the type you choose, make sure you can rotate the contents occasionally and that the compost receives water and heat.|Non-Forecast
Think about it.|Non-Forecast
Information flows could be supervised in the age of the Internet and social media.|Forecast
The next generation of employees will demand solutions even more strongly.|Forecast
Comic books and video games have had a long, incestuous life together.|Non-Forecast
What personality traits and values help agile teams bloom? Discover ways to identify these when recruiting and coaching your people.|Non-Forecast
Two of the big questions being asked in this lawsuit are whether the FCC had sufficient reason to change the classification of broadband so soon after the 2015 rules were adopted and whether the agency has the right to pre-empt states, like California, from adopting their own net neutrality laws.|Non-Forecast
Latvias integration policy envisages promotion of society integration by increasing levels of knowledge of the state language among all ethnic groups.|Forecast
The renovated stadium will also be optimized for energy efficiency and tap into passive ventilation strategies.|Non-Forecast
Turkey has long advocated a secure zone for displaced civilians in Syria threatened by Islamist militants or forces fighting for Syrian President Bashar al-Assad.|Forecast
Climate change is expected to affect the capacity of existing water and sanitation infrastructure and services.|Forecast
General Mattis was a comfort to many who were concerned about the path the Trump Admin would choose to take.|Non-Forecast
Bush was an accomplished man, a patriot, part of the generation that sacrificed itself to defeat Japan and Germany.|Non-Forecast
East Africa will increasingly be drawn into a wider macro-region comprising the nations of the Indian Ocean basin.|Forecast
Of the 48 million Christmas trees Americans bought last year, a whopping 27 million of them were real. And that can actually have a positive effect.|Non-Forecast
On average, however, participants could identify only 14 out of 22 diseases associated with physical inactivity.|Non-Forecast
Trump was referring to the practice of thinning forests that become overgrown after decades of fire suppression.|Non-Forecast
Giancarlos Troncoso Parady of the University of Tokyo told Reuters Health by email. |Non-Forecast
2016 will be remembered as the year that the global underclass revolt crystallised in the form of the Brexit and the Trump election.|Forecast
NASA will spend up to $25 million to purchase small sat data to help with its study of Earth science.|Forecast
The finance and health ministries estimate exports could raise tax income by 1 billion shekels ($265 million) a year.|Non-Forecast
Travel went digital a long time ago, but the digital customer isnt standing still.|Non-Forecast
UK childrens services will see a 1.9bn gap emerge between funding and need from 2016-17 to 2019-20.|Forecast
A few years ago it looked like we might solve the lockout issue with dual angle dashboard screens that show the driver one interface while showing the passenger another, based on their angle of view being about 90 degrees apart. |Non-Forecast
A Democratic victory could boost European markets by as much as 5%.|Forecast
Latest Obama-era regulation to face EPA political pressure may not see too much change.|Non-Forecast
The global commons will remain a critical enabler of international security, trade and communication.|Forecast
Global population aging will put pressure on social and economic support systems-especially in countries like China.|Forecast
Canada will impose a carbon price on provinces that do not adequately regulate emissions by themselves.|Forecast
Governor Jerry Brown on Friday signed legislation that will now require anyone who 3D prints a gun to obtain a serial number or other mark of identification.|Forecast
Times run out for net neutrality supporters hoping to restore Obama-era regulations using a legislative loophole, but the fights far from over as it heads to federal appeals court.|Non-Forecast
The move comes after a failed attempt to get the IWC to set legal quotas for legal hunting by its members.|Non-Forecast
Indian shares bounced back from a more than two-week low today to close over half a per cent higher, helped by gains in financials such as HDFC Bank Ltd and Housing Development Finance Corp Ltd.|Non-Forecast
Facebook builds censorship tool to attain China re-entry.|Forecast
Large compliance projects for data protection and gender pay gap reporting will dominate the HR agenda in 2017.|Forecast
On July 1, 2017, state law will require public colleges in Kansas to allow licensed firearm owners to carry concealed weapons on campuses.|Forecast
Startup follows on a number of innovative ideas to make renewable energy more flexible.|Non-Forecast
Networking only works at the speed of light and moving data center closer to consumers will only improve performance.|Forecast
American farmers are forecast to be big losers in a world of unchecked global warming.|Forecast
The cooperative constructed the entire bamboo structure, while local workers from Fazenda Catuabas on-site farm carried out the excavation work, foundation work and brick laying.|Non-Forecast
To those few Senators who think I dont like or appreciate being allied with other countries, they are wrong, I DO, Trump also tweeted.|Non-Forecast
It is ideas, not money, that solves problems.|Non-Forecast
Kind of like what you get on a much more expensive Mercedes-Benz G-Class or a Range Rover, Jeeps Off-Road Pages give you information about your steering wheel angle, transfer case, the vehicles pitch and roll angles, ride height, traction management system information and whether your sway bar is connected/disconnected or whether your axles are locked/unlocked.|Non-Forecast
The declining cost of solar and wind energy, grass-roots activism, legal action in U.S. courts and international pressure could help counter whatever efforts a Trump administration might make to undo existing policies.|Forecast
I think theres an implication here for Nancy Pelosis election for the speakership, he continued. |Non-Forecast
An advance could find applications in quantum information processing, sensors and studies into the fundamental physics of quantum mechanics.|Forecast
Although the real-life impact of a partial government shutdown would be minimal, its prospect facilitates end-of-the-world rhetoric that the 24/7 news cycle thrives on.|Non-Forecast
Only by acquiring a countervailing nuclear weapons capability will the ROK have the leverage to negotiate with the North on the reduction and eventual elimination of nuclear arms on the Korean Peninsula.|Forecast
The need for alternative energy will be a significant security issue.|Forecast
A final environmental report should be released in the summer, Balash said.|Non-Forecast
The UKs government has recently put into place a mandate that makes retailers and producers of packing responsible for the cost of collecting and recycling material.|Non-Forecast
In the coming year, the Scottish Government will have the opportunity to breathe life back into the solar industry with the publication of its new strategy on climate change and energy.|Forecast
Growth in Pacific Island countries will be buoyed by improved trade, tourism, and remittances.|Forecast
 In September, the share of emerging-economy respondents reporting negative views was nearly double the share of their developed-economy peers.|Non-Forecast
The interior of the home, however, is where the design really shines. According to the team from Wind River Tiny Homes, the couple wanted a home that was no more than 600 square feet.|Non-Forecast
The U.S. Centers for Disease Control and Prevention advocates tapering and, in some cases, discontinuing opioids in patients using them as long-term therapy for chronic pain.|Non-Forecast
In Asia and Latin America, publication print and advertising print will make more significant contributions to growth.|Forecast
The military campaign against ISIS in Syria and Iraq and improved law enforcement and intelligence efforts aimed at foreign fighters will cause them to increasingly focus on domestic attacks.|Forecast
The most scientifically effective exercises you can do with a Christmas ham.|Non-Forecast
Star Wars fans aching for the Galaxys Edge theme park attraction to open got a Christmas gift from Disney.|Non-Forecast
A tightening US labour market could force the Fed to raise rates earlier than the current market consensus.|Forecast
These are dramatic numbers. |Non-Forecast
