Centuries of looters have ransacked the burial mounds for the ornate gold art and jewelry, as well as the finely crafted weapons and horse gear buried with the Scythian dead.|Non-Forecast
There are times when a nation simply cannot avoid running a deficit, such as a war of survival or a sharp recession. That is not the case as we head into 2019.|Non-Forecast
Like Buescher, Barrett is a Catholic. She is considered a serious contender for the Supreme Court, should another vacancy arise during the Trump administration.|Non-Forecast
Meat companies learned a lesson from the plant-based milk revolution, and they are focusing their efforts on shaping the regulatory environment for their new competitors.|Non-Forecast
His comments came after Mnuchin on Monday held a conference call with U.S. regulators to discuss plunging U.S. stock markets.|Non-Forecast
Perus significant copper project pipeline and Brazils competitive iron ore sector are set to offset internal political and operational risks to consolidate them as the main drivers of investment in Latin Americas mining sector.|Forecast
There are still things to like about each FAANG stock, of course. |Non-Forecast
Amazon recently rolled out its first Echo device for the car which, over time, should grow to have deeper roots into the cars functions. |Non-Forecast
Both senators undoubtedly felt blindsided by the casual announcement of such a significant policy alteration in a tweet, as did many U.S. allies.|Non-Forecast
SpaceX sued the U.S. Air Force in 2014 in protest over the militarys award of a multibillion-dollar, non-compete contract for 36 rocket launches to United Launch Alliance, a partnership of Boeing and Lockheed.|Non-Forecast
V2V and V2I will be important as ways to keep cars of the next decade safe and out of each others path.|Forecast
Electric, hybrid and methane gas-powered cars currently make up only around 7 percent of Italys car sales.|Non-Forecast
Rising inequality and social polarisation posed two of the biggest risks to the global economy in 2017 and could result in the rolling back of globalisation.|Forecast
Some African countries might not be able to attract investors because of a perception of political risk.|Forecast
During the brief visit to Iraq, Trump and the First Lady met inside a tan domed tent with U.S. Ambassador to Iraq Douglas Silliman and National Security Advisor John Bolton, as well as LaCamera and other U.S.officials.|Non-Forecast
Indonesia is still in the declining period of the dependency ratio with its population projected to pass 300 million in the next 20 years.|Forecast
The introduction of unmanned and autonomous systems into crisis-prone regions will complicate efforts at maintaining crisis stability.|Forecast
Total IT spending in Malaysia is expected to grow by 3.3% to be worth $21.16bn in 2017.|Forecast
Digital ad fraud was projected to cost marketers more than $7 billion in 2016.|Forecast
Trump said he had told his advisers, lets get out of Syria, but was persuaded to stay, before deciding last week to bring the 2,000 troops home.|Non-Forecast
 About half were randomly assigned to have six neurofeedback training sessions over a four-week period using the amygdala electrical fingerprint technique.|Non-Forecast
China is different.|Non-Forecast
The slim brick facade is Cradle-to-Cradle certified and highly durable to ensure longevity.|Non-Forecast
The advancement from paper ledgers and manual processes to electronic trackers on a distributed ledger will reduce errors and accomplish in minutes what used to take days.|Forecast
Thank you to The Daily Signal for doing your part in making America greater.|Non-Forecast
I tried a ton of cheap wire-free earbuds this year, and most of them failed in one way or another: bulky charging case, over-sensitive touch controls, bad fit, poor sound quality, etc.|Non-Forecast
Thats why we were elected and its time we follow through, Meadows told the The Daily Caller News Foundation days before the partial government shutdown.|Non-Forecast
Just two short years after the end of the Obama administrations disastrous policies, America is once again thriving due to conservative solutions that have produced a historic surge in economic growth.|Non-Forecast
Administration officials said Trump was annoyed by Mattis resignation letter, which included an implicit criticism of Trumps disregard for allies.|Non-Forecast
Political instability has worsened in the Democratic Republic of Congo following concerns that President Joseph Kabila will refuse to abide by constitutional term limitations and remain in power.|Forecast
Governments across much of the developed world will begin making higher ed tuition free for all.|Forecast
By 2040, 33 countries would be at risk from water-stress.|Forecast
The Australian precision agriculture market is forecast to increase its share over the next 5 years.  Adoption of remote monitoring, Big Data, variable rate technology and farm management software will also drive the precision agriculture market.|Forecast
The latest move on gold should be a stark reminder to investors that gold in any form should be an essential part of any long-term investment strategy as again they yellow metal has proven its weight when markets turn turbulent, Stephen Innes, APAC trading head at OANDA in Singapore, said in a note.|Non-Forecast
The pattern persisted when researchers looked only at tweets made between 2 a.m. and 6 a.m. Furthermore, players who were infrequent late-night tweeters were affected more than those who habitually stayed up and tweeted late at night frequently.|Non-Forecast
Galileo, the European global satellite navigation system, is expected to start operating by the end of 2016 and to reach its full operational capacity in 2019.|Forecast
Indications so far are that the new administration led by Prime Minister Theresa May will continue with plans to devolve power.|Forecast
A smart city uses ICT, including mobile networks, to improve the quality of livelihood in a sustainable way.|Forecast
Around 900 BCE, a group of nomads from Siberia called Scythians began spreading across the central Asian steppe, their mounted archers sweeping across huge swaths of territory. |Non-Forecast
Economic and political factors will be critical in determining the future of the ISS.|Forecast
Christmas is in the rear-view mirror, but there are still sales and deals to be had. |Non-Forecast
There is a risk that AI-driven automation will increase the wage gap between less-educated and more educated workers.|Forecast
A set of dedicated API factory teams, embedded in different business and technology units, works cross-functionally to build and consume APIs. |Non-Forecast
And the best way you can partner with him is by becoming a member of his greatest ally in Washington: The Heritage Foundation.|Non-Forecast
Trump spoke to troops gathered in a dining hall festooned with holiday decorations and teased soldiers about their favorite football teams.|Non-Forecast
AI will enable new wealth creation that will require social debate on how the economic fruits of AI technologies should be shared.|Forecast
We freely acknowledge that there are many other dimensions than the economic to Chinas global impact; however, in this article, we focus on Chinas economic relationships with the world.|Non-Forecast
The White House should stop the posturing and start serious bipartisan talks, Hammill said.|Non-Forecast
An additional 2 billion per year for research and innovation will be invested by 2020/21 to unlock the full potential of the UKs research base in areas such as robotics and biotechnology.|Forecast
IUU fishing threatens sustainability of global fisheries.|Forecast
Communities across Indonesia threatened by illicit labor recruitment must cooperate closely to eliminate a practice that facilitates human trafficking.|Forecast
U.S. intelligence officials and senior military officers have become increasingly concerned that the Islamic States rapid advances in Libya could lead to new waves of strikes inside Tunisia that could decimate its fragile economy and derail Tunisias fledgling experiment with democracy.|Forecast
AI could even analyze the relationships of suspects and convicted criminals to predict whom they could have interacted with.|Forecast
And, the best part is, you dont have to say no to your moms famous meatloaf at your next family dinner.|Non-Forecast
China will strengthen the struggle against enemies in online sovereign space and increase control of online public sentiment.|Forecast
But with the House now firmly within the grips of the progressive left, the victories may come to a screeching halt.|Non-Forecast
While you formulate your list of new years resolutions, be sure to include a few goals focused on sustainability.|Non-Forecast
A new NATO-led mission in Iraq is also working to develop security institutions and structures within Iraq.|Non-Forecast
Garnica stressed that 2017 will be a very difficult year because of the changes that are to be enforced in the phytosanitary regulations for imports to the United States.|Forecast
Investors said his move to convene a call with the presidents Working Group on Financial Markets, known as the Plunge Protection team, may have weighed on sentiment.|Non-Forecast
In Brazil the economic outlook could be negatively affected by the deepening political crisis.|Forecast
These federal workers want the wall, Trump said during a question-and-answer session in the Oval Office on Christmas Day.|Non-Forecast
As a result, he is trimming his position in Netflix and instead adding to his position in streaming television company Roku Inc (ROKU.O), which has a market value of approximately $3.3 billion, compared with Netflixs market value of $116.3 billion.|Non-Forecast
To reposition the stadium as the heart of a new mixed-use health and wellness hub, Sasaki plans to not only extend the lush landscape of the adjacent Luxun Park to the stadium grounds, but also add the elevated Midline, a recreational spine beneath the light rail tracks that provides pedestrian and bicycle access from the north and south to the stadium. |Non-Forecast
Oil production will progressively increase without reaching full capacity before 2020 due to the time necessary to restore the heavily damaged oil infrastructure.|Forecast
In 2018 the EU will enforce its General Data Protection Regulation which will give users the right to ask for an explanation of an automated algorithmic decision that was made about them.|Forecast
Chicago will activate the first wave of sensors, cameras and microphones later this summer, monitoring the citys environment, as well as pedestrian and vehicular traffic.|Forecast
Google and Boston Consulting Group studied Indias payment landscape and estimated (July 2016) that the total payments conducted via digital payment instruments will be in the range of $500 billion by 2020.|Forecast
Britain could save 5 billion pounds ($6.64 billion) a year by 2050 if it invests now in technology to capture and store emissions underground.|Forecast
The Christian faith is central to the program. |Non-Forecast
Smart commercial buildings will be the biggest users of IoT technology through 2017.|Forecast
In the next five years batteries in new vehicles will evolve in order to meet more stringent global emission regulations.|Forecast
Anti-LGBT statements by politicians and officials in 2016 ranging from the absurd to the apocalyptic have been accompanied by many threats and violent attacks on LGBT activists and others primarily by militant Islamists.|Forecast
American protectionism is likely to provoke trade wars that could plunge the world economy into recession.|Forecast
I am highly confident that the president is very happy with Secretary Mnuchin, Hassett told Fox Business Network.|Non-Forecast
Local Highway Authorities will become a key stakeholder in supporting MaaS growth.|Forecast
The Trump administration has embraced over 60 percent of The Heritage Foundations policy recommendations since his inauguration. |Non-Forecast
When it comes to electric vehicles, Tesla has been the leader of the pack, at least in terms of press coverage and public attention.|Non-Forecast
The growing range of 3D-printable materials will drive a compound annual growth rate of 64.1% for enterprise 3D-printer shipments through 2019.|Forecast
The cabin is lifted off the ground to reduce impact on the natural landscape.|Non-Forecast
As well as a pre-soldered Raspberry Pi motherboard, its small-scale components include a wide-angle camera, loudspeaker, touch screen and control pads.|Non-Forecast
All six tested games included loading times that were anywhere between 50-80 percent longer with Denuvo enabled.|Non-Forecast
The shutdown of all but essential federal services due to a Capitol Hill fight over U.S. President Donald Trumps funding demands for a Mexico border wall comes at the height of the Christmas travel season.|Non-Forecast
Trumps pledged support for fracking could wind up hurting coal further.|Forecast
The number of electronic national IDs in circulation will reach 3.5 billion citizens by 2018.|Forecast
From raw materials through manufacturing all the way to retail, the apparel industry continued to be scrutinized for sustainability in 2018.|Non-Forecast
The other half of the soldiers were divided into two groups: half underwent a general neurofeedback training program not targeting any particular brain area, and the other half got no neurofeedback training.|Non-Forecast
But these are corruptions that have grown up around the system, not integral defects within the Founders design.|Non-Forecast
Investors are uneasy about global economical growth and are seeking gold as a safe-haven, said Yuichi Ikemizu, Tokyo branch manager at ICBC Standard Bank, adding the sharp sell-off in stock markets has also lent support.|Non-Forecast
Some observers believe such a collapse and consequent drawdown on global savings would have a knock-on effect on the global economy reminiscent of the 2008 financial recession.16 It would also put Chinas long-term economic development at risk.|Non-Forecast
Machine learning, which gives computers the ability to learn without being explicitly programmed, is ready to take off. |Forecast
Covert agents, working on behalf of IS, could pose as chemists, storage clerks, security guards or medical workers to obtain uranium or plutonium and then transfer the isotopes to a secret location to build a bomb.|Forecast
Economists forecast 4.1 percent growth in Peru in 2017.|Forecast
German authorities recently broke up a suspected far-right militant group known as Oldschool Society and there are concerns that similar groups could emerge elsewhere.|Forecast
Truman approved, but McGrath did not. |Non-Forecast
The UK could well opt to apply to the European Commission for a decision that its data transfer system as a whole is adequate -obviating the need to prove legality each time data flows are contemplated.|Forecast
Adidas announced a factory in Germany that will begin manufacturing shoes using robots in 2017.|Forecast
The liberal Left continue to push their radical agenda against American values. |Non-Forecast
The utility of the future will be a fully digital system.|Forecast
He just wants a smooth, more quick transition and felt that dragging it out for a couple of months is not good, the official said, on condition of anonymity.|Non-Forecast
Big data could provide the UK with a potential 157,000 extra jobs and 241bn benefit to the economy by 2020.|Forecast
Apple will need to rely heavily on proprietary technologies, software, processors.|Forecast
The organization has some 15,000 chapters.|Non-Forecast
If everything remains business as usual, by 2030, half of the worlds youth will not have the basic high school level skills to succeed in the world of work.|Forecast
Asias exports are set to benefit as global growth is expected to recover in 2017.|Forecast
Agricultural robot Agbot II could save Australias farm sector $1.3 billion a year by reducing the costs of weeding crops by around 90 per cent.|Forecast
Coral bleaching (linked to global warming) and coral damage due to ocean acidification are increasing the risk of ciguatera.|Forecast
Chinas economic and strategic importance in the region is likely to continue growing and demographic change in Australia will gradually make it an unambiguously Asian country with a large and successful ethnically Chinese community.|Forecast
The political turmoil added to fears about the economy that are plaguing investor sentiment, helping fuel continued heavy losses in the stock market on Friday.|Non-Forecast
29 billion devices will be connected by the year 2022 of which 18b will be related to IoT.|Forecast
The launch would be the first of 32 satellites in production by Lockheed under contracts worth a combined $12.6 billion for the Air Force GPS III program, Lockheed spokesman Chip Eschenfelder said.|Non-Forecast
Others contend that there is a chance that the multiple crises currently facing the EU could produce some beneficial EU reforms.|Forecast
Italy rejigs measures to spur sale of green cars.|Non-Forecast
While Congress did expand counter-drone authorities this past year, more work remains to be done so that we are better prepared for something like what has happened in Gatwick.|Non-Forecast
Japan is an economically mature country and any strategy of making the economy grow will take time.|Forecast
It can be expanded easily, and, unlike chemical batteries, such a system is made of common and cheap industrial materials that have 20-year lifespans.|Non-Forecast
Qualcomm shares were down 0.2 percent at $56.69.|Non-Forecast
To successfully implement a War on ISIS requires successfully implementing a War on Climate Change that will avoid political destabilization and unrest to minimize immigrant flows in other parts of the world.|Forecast
Firs have soft and flat foliage, with needles that look like theyre stuck to the branch with a suction cup.|Non-Forecast
Retroactive pay for essential federal workers is only likely to come with Congressional approval after the shutdown ends.|Non-Forecast
We assign intent to others actions|Non-Forecast
Conservative organizations such as The Heritage Foundation and FreedomWorks, as well as the liberal Brennan Center for Justice and the American Civil Liberties Union, oppose mandatory minimum sentencing.|Non-Forecast
In Singapore, the luxurious backdrop for the movie Crazy Rich Asians, what passes as trash for one household ends up in a shipping container on its way to the home country of a migrant worker.|Non-Forecast
2.6 million Syrian children are no longer going to school.|Forecast
Africans may not be able to feed more than 25 percent of its population in 2025.|Forecast
The public sector as a strategic purchaser of new technologies could drive the uptake of the IoT.|Forecast
Throwing in the towel rightly would have been seen as a betrayal, and it would almost certainly doom any chances Trump has of re-election in 2020.|Non-Forecast
Its shares rose 1.67 percent in after-market trading, to $3.65.|Non-Forecast
In his letter, Mattis had said he would step down at the end of February to allow for a successor to be confirmed and attend Congressional hearings and a key NATO meeting.|Non-Forecast
Zion National Park drew 107,000 visitors between Dec. 22 and Dec. 27 a year ago, Varela said.|Non-Forecast
Unpicking EU trade deals and replacing them with British deals could usher in a decade of complicated negotiations that would end in a less favourable deal for Britain.|Forecast
However, you can remedy this by eating plenty of nuts, seeds, whole grains and legumes.|Non-Forecast
The numbers of UK households at significant risk of flooding will more than double to by 2050.|Forecast
Its Christmas day and Ars staffers are enjoying a winter break (inevitably filled with series binge-watching and fancy egg preparations).|Non-Forecast
Chip supplier Qualcomm Inc won a second court skirmish in its worldwide patent battle with Apple Inc on Thursday, with the iPhone maker saying it would pull some older models from its German stores.|Non-Forecast
Alexa is not having a breakdown.|Non-Forecast
Either way, the market is providing options for consumers on both sides of the aisle.|Non-Forecast
It remains unclear what agreements, if any, have been reached with Turkey to ensure the enduring defeat of ISIS. |Non-Forecast
That culture developed when very few women were in medicine, Wu said. Doctors, mostly male, had wives to take care of the children and the home. |Non-Forecast
By 2019, 10% of out-of-production spare parts for cars, trucks, bicycles and motorcycles will be 3D printed.|Forecast
The chief minister also accused the Centre of neglecting the state in all spheres.|Non-Forecast
Chinese exports of electric bicycles will increase rapidly.|Forecast
The current study tested the effectiveness of neurofeedback sessions using this EEG fingerprint in changing soldiers ability to control their amygdala activity.|Non-Forecast
Well-meaning regulatory action risks increasing compliance costs to the point that additional safety and fuel-efficiency technologies put new vehicles out of financial reach of the average new car purchaser.|Forecast
The liberal Left continue to push their radical agenda against American values. The good news is there is a solution.|Non-Forecast
Economic growth  in Hong Kong is expected to slow sharply in 2016 amid shrinking trade flows and a property market downturn.|Forecast
A million more jobs will be created by the end of the UK Parliament.|Forecast
Advances in digital infrastructure and new technologies will enable the development of an intelligent technological layer.|Forecast
Brexit will force the UK government to raise borrowing by 60bn.|Forecast
A long-term structural trend has been under way over the past decade to shift some manufacturing activities out of China.|Non-Forecast
The Eighth Amendment forbids cruel and unusual punishments, or, as Chief Justice Earl Warren explained, it prohibits punishments that defy evolving standards of decency that mark the progress of a maturing society.|Non-Forecast
An unmanned and autonomous systems-centered war-fighting regime will have profound implications for how political leaders and military commanders interpret adversary behavior.|Forecast
Moderate gas prices that are relatively flat (i.e., approximately $4.50/MMBtu over the next 20 years) will leave the U.S. industrys emissions near todays levels.|Forecast
Not long ago, Ofo was racing into markets overseas and raising billions from backers including Alibaba Group Holding Ltd (BABA.N) and Didi Chuxing.|Non-Forecast
By positioning the stadium as a community asset, its renovation reaches far beyond its original function, reads Sasakis press release.|Non-Forecast
Earlier this month, Trump threatened a partial government shutdown if he could not get funding for the wall. |Non-Forecast
In Iraq, where ISIS once controlled large swaths of territory, U.S. forces have aided Iraqi troops in a protracted and grinding battle against the terrorist group that began under President Barack Obama in 2014. |Non-Forecast
The threat of ambush by Renamo guerrillas will continue to throttle the coal industry and other businesses in northern and central Mozambique.|Forecast
The U.S. should support this process along the way but remain skeptical of the Talibans motives.|Non-Forecast
Design, whether its of products or experiences, is not only about aesthetics but also about specific actions taken to boost revenues and customer engagement.|Non-Forecast
The influence of consumer Software as a Service (SaaS) and Platform as a Service (PaaS) on Higher Education spending and implementation will continue to broaden.|Forecast
Mr Trump could wilfully ignore Americas obligations to cut emissions-although it is more than halfway to meeting its own target of cutting emissions 26-28% below 2005 levels by 2025 it is widely expected to miss the mark.|Forecast
A rapid change of leadership could plunge the EU back into crisis.|Forecast
After 40 years of practice as a surgeon, and having undergone 40 operations himself, Richardson sees the need for practical advice, especially as minimally invasive procedures become more popular, and patients are discharged from the hospital quickly to recover at home.|Non-Forecast
Green building in North America, Europe, the Middle East, and Asia-Pacific will continue to grow as more building owners come to accept the business case.|Forecast
Open source MOOCs will adapt organically.|Forecast
Regions such as the Middle East and parts of Sub-Saharan Africa are at risk of increased conflict due to resource conflicts caused by climate change and an exploding population.|Forecast
Probably the biggest obstacle outside of the scientific ones is getting folks used to the idea that we dont need to slaughter animals en masse and deal with our waste to enjoy a nice Turkey dinner for Thanksgiving, Tetrick says.|Non-Forecast
By 2020, the luxury goods industry in China is expected to have a healthy growth rate and is expected to continue to grow in spite of a slower economic growth.|Forecast
Shares of Apple were down 2.3 percent at $157.12 in late trading, weighing on the broader market.|Non-Forecast
Upwards of 800,000 federal employees are impacted by the shutdown, more than a third of all government staffers.|Non-Forecast
Relatively high cost of protein A resin and increasing awareness about alternate methods for purification of MAb is expected to hamper overall sales of protein A resin during the forecast period.|Forecast
