Instead, he is increasing his position in companies with strong recurring revenue streams such as Adobe Inc (ADBE.O), Visa Inc (V.N), and Microsoft Corp (MSFT.O).|Non-Forecast
An attempt to remove the Fed chairman would be unprecedented and seen as an attack on the U.S. central banks independence, which is meant to insulate it from political considerations.|Non-Forecast
And as this new report shows, they are evolving away from state-sponsored killings.|Non-Forecast
Facebook, Microsoft, Twitter and YouTube will create a database containing digital fingerprints of the content, screening uploads, known as hashes, in order to spot violent or extremist material before it is shared.|Forecast
Punes population has surged in recent years from 3.57 million in 2001 to 4.99 million in 2011 and is forecast to continue growing to 6.9 million in 2021 and 7.73 million in 2031.|Forecast
Selected over shortlisted proposals from prominent firms such as BIG and Henning Larsen, Lendager Groups winning design aims to create the first building project in the world that translates all 17 of the United Nations Sustainable Development Goals (SDGs) into tangible action. |Non-Forecast
On Thursday, the House overwhelmingly approved the Senates amended version by a vote of 358-36.|Non-Forecast
More than 420,000 employees will have to work without pay for the duration of the shutdown, including 88% of the Department of Homeland Security and more than 41,000 federal law enforcement and correctional officers. |Non-Forecast
Russia represents the biggest cybersecurity threat for the US.|Forecast
Global demand for energy per capita will peak in 2030 thanks to new technology and stricter government policies.|Forecast
Canada will speed up plans to virtually eliminate traditional coal-fired electricity by 2030.|Forecast
Over time, Amazon wants to get better at handling complex customer needs through Alexa, be they home security, shopping or companionship.|Non-Forecast
The Virginia-born Henderson, a former Democrat, represented in the Senate what was then considered a Western state, Missouri, which both the Union and Confederacy claimed. So, his backing was important political symbolism.|Non-Forecast
Tesla Motors Inc. shares tumbled today amid concern the election of Republican Donald Trump as president will lead to an easing of fuel economy and emissions regulations that have benefited the EV maker.|Forecast
Global socio-political tension (US) and the threat of ISIS) together with concerns about growth in US, China and Europe are foremost.|Forecast
Many banks deem the risk of entering the Iranian market too high due to the political challenges on the U.S. side.|Forecast
Over 7 billion people live on Earth, which means feeding our growing population will require us to produce food more efficiently than we are now.|Non-Forecast
Complexity will be much higher and will demand even more sophisticated technology offerings.|Forecast
In the absence of good governance Lebanons energy windfall will likely lead to more corruption.|Forecast
Mattis has been highly respected on both sides.|Non-Forecast
The U.S. Senate adjourned on Saturday, unable to break an impasse over Trumps demand for more funds for a wall on the border with Mexico that Democrats are unwilling to accept.|Non-Forecast
French legislation introduced will mean that all plastic cups, cutlery and plates sold will need to be compostable.|Forecast
A doubling of global transport demand will lead to an increase of transport CO2 emissions of 60 percent between 2015 and 2050.|Forecast
Foreign collectors will likely increase targeting of the emerging technologies of computational modeling of human behavior, quantum systems, synthetic biology, and cognitive neuroscience.|Forecast
In early 1864, as the Civil War raged, Sen. John Henderson of Missouri was among the first to draft a constitutional amendment to abolish slavery.|Non-Forecast
American millennials see global warming as a bigger threat than China or Islamic fundamentalism.|Forecast
Some conservationists said it would be better to close parks entirely, as happened under President Barack Obamas administration during a 2013 shutdown, rather than keep them open with skeleton staff.|Non-Forecast
There have been worries in South Korea that a Trump presidency could bring a major shift in US economic and diplomatic ties with Seoul.|Forecast
China will further crack down on smuggling of foreign agricultural products and the import of prohibited foreign garbage including plastics.|Forecast
In 2025, Society could be grappling with a decline in life expectancy in Asia, Africa and the Middle East.|Forecast
Over the past five years, Singles Day sales have been on a tear, leaping an average of almost 50 percent year over year and significantly outpacing the overall growth of online retail in China. |Non-Forecast
Risks include the imposition of higher fees for EU students, new visa rules, and an end to EU research grants.|Forecast
In an era of corruption schemes and offshore leaks, hybrid business and its weaponization by the government have emerged as both a central feature of Russian governance and a potent risk both to itself and the outside word.|Forecast
Thats what an effective, compelling messaging strategy would look like if Republican leaders would just overcome their irrational shutdown-ophobia and fight back with all the weapons at their disposal.|Non-Forecast
Asian equities were shaky following a Christmas eve U.S. stocks plunge. |Non-Forecast
Although Kennedy was largely unsympathetic to arguments that particular methods of execution were needlessly cruel, he often voted with the Courts liberals in cases arguing that certain individuals cannot be executed.|Non-Forecast
The U.S. will miss its 2025 carbon emissions target by a wide amount.|Forecast
Yes, I do. Very talented guy.|Non-Forecast
When the rules were codified in 2015, they required coal plants to add expensive technology to minimize the amount of mercury spewed into the air.|Non-Forecast
The U.S. will continue to utilize the channel of communications established with Russia to de-conflict counterterrorism operations in Syria.|Forecast
Comparison with Japan as it stood in the 1990swhen it was the worlds second-largest economy behind the United Statesis instructive.|Non-Forecast
The initiative moves the cost of recycling packing from the taxpayer and local authorites to the producer.|Non-Forecast
There will be a period when the world trading and financial system retreats from openness.|Forecast
Pelosi largely locked up the speakership weeks ago.|Non-Forecast
The US administration had signaled a desire to reduce the burden on banks and named new leadership at the three banking agencies, including the Federal Reserve.|Non-Forecast
The researchers compared mortality rates for male U.S. astronauts to professional athletes from Major League Baseball (MLB) and the National Basketball Association (NBA) between 1960 and mid-2018.|Non-Forecast
Now, its tangible, visible, its rising up all around us.|Non-Forecast
An unexpected development in the Mueller investigation occurred Tuesday.|Non-Forecast
In mid-October, Tesla promised that any orders placed by October 15 would be delivered by the end of the year, thus qualifying for the full tax credit. Later, Tesla appeared to extend this deadline to November 30.|Non-Forecast
The Global eLearning Market is in Steep Decline and the growth rate for eLearning in Brazil is quite negative at -19.8% and revenues will decline dramatically to $322.8 million by 2021.|Forecast
Trump has come under withering criticism from fellow Republicans, Democrats and international allies over his decisions about Syria and Afghanistan, against the advice of his top aides and U.S. commanders.|Non-Forecast
Not only will you have a new understanding of the work and resources that go into growing and harvesting your food and making the products you use everyday, but you will also reduce your waste.|Non-Forecast
Uncertainty about the status of EU workers in the UK and further risks to the supply of skilled engineers are likely to result in delays to infrastructure projects such as HS2.|Forecast
Will you activate your membership with a tax-deductible gift today?|Non-Forecast
For those who insist on dressing in their finest Vrogas Vas linens and representing the Jedi Order in our own, simpler galaxy, replica lightsabers are the only way to go.|Non-Forecast
Company directors who dont properly consider climate related risks could be liable for breaching their duty of due care and diligence.|Forecast
Government figures confirm that emissions are predicted to rise to 2030 in Australia.|Forecast
Trump first announced Mattis decision on Twitter.|Non-Forecast
A brief period of weak foreign direct investment should be expected as the UKs new relationship is renegotiated.|Forecast
South Korean retail giant Lotte Group said Wednesday that it will build a new shopping assistance chatbot using IBMs artificial intelligence system Watson with an aim to provide customized shopping support to customers.|Forecast
India could not join Combined Maritime Forces because it operates outside the UN and India does not want to operate with sub-groupings that do not operate under the auspices of the global community.|Forecast
Tunisia will be one of the most water-stressed countries in 2040.|Forecast
The broader adoption of telehealth services could save the United States as much as $4.28 billion on health care spending per year while improving patient care and outcomes.|Forecast
The UKs long-term (2020 and beyond) real GDP post-Brexit will be 3 to 8 percentage points lower than the GDP that the nation would achieve if it remained an EU member.|Forecast
Harnessing advances in AI to their fullest potential will involve collaboration by industry, government, and the public on the broader social, legal, and ethical influences of AI.|Forecast
Israel-based Mellanox was founded in 1999 by former Intel and Galileo Technology executives and went public in 2007. |Non-Forecast
More than a month later, the 40-year-old French leader has backtracked on his fuel tax, and Paris has already mostly repaired the physical damage of the riots. |Non-Forecast
But, there would be zero health benefits.|Non-Forecast
If wage differentials continue along their current trajectory, the UK will have returned to Victorian levels of income inequality by 2030.|Forecast
Leaders everywhere will need to adopt creative and aggressive policies to boost a world economy that now seems stuck in neutral.|Forecast
Researchers compared nearly 60 years of data on U.S. male astronauts and a group of men who are similarly extra-fit, affluent and receive elite healthcare - pro athletes. |Non-Forecast
Lets take a look at some of the more interesting and, wed guess, prescient, of them.|Non-Forecast
Trump could conceivably bring peace by letting the Russians finish off the Syrian opposition.|Forecast
7 percent of global population will see a decrease of 20 percent or more in renewable water resources.|Forecast
The implementation of fuel sulfur regulations to address air pollution will drive demand for hydrotreating catalysts.|Forecast
How we collectively disperse the carbon, metal, and plastic that went into our trees makes a real difference for the environment that provided those resources in the first place.|Non-Forecast
Israels desperate attempts to outlaw the BDS movement and to legally bully its supporters into silence threatens democratic space.|Forecast
ts only been two years, though, and while other companies crash and burn in the market in that amount of time, HMD has made incredible progress. |Non-Forecast
This is not defeat.|Non-Forecast
 They defined late-night tweeting as activity between 11 p.m. and 7 a.m.|Non-Forecast
Lithuania will not grow any GM crops.|Forecast
Building the wall was one of Trumps most frequently repeated campaign promises, but Democrats are vehemently opposed to it.|Non-Forecast
When you consider that animals drink water and also consume foods that require water to grow, the effects are staggering, and it explains why many vegans have chosen a meat-free diet.|Non-Forecast
One billion people in 2030 will still be without electricity access.|Forecast
An expansion of gas imports through the Southern Gas Corridor could be influenced by Turkeys political trajectory.|Forecast
If realized, these gains could propel China to become not only the worlds largest economy and manufacturer, but also its largest investor and market.|Non-Forecast
In addition to gouging water resources, animal production requires massive amounts of land.|Non-Forecast
In the next 5 - 10 years, 3 million US truck drivers will be the first to suffer as the transport industry goes driverless.|Forecast
EU support for innovation and education in Tunisia will benefit the whole of North Africa.|Forecast
Russias own data on near-Earth objects could soon be made publicly available as a comprehensive database.|Forecast
Through three decades of dramatic cases  Marshall defended the federal government against unruly states, established the Supreme Courts right to rebuke Congress or the president, and unleashed the power of American commerce.|Non-Forecast
Hit by bad loans, Chinese banks are expected to show a weakening in their capital strength in first-half earnings, raising the prospect that government might have to inject more than $100 billion to shore them up.|Forecast
Cynthia Adams Singletary, a lawyer for Dowless, could not be reached for comment on Monday.|Non-Forecast
The digital realm opens up a whole new set of options for your gift buying. |Non-Forecast
So, he took it upon himself to reconfigure a mill such that it required human movement to keep it going, which is how it got the name treadmill.|Non-Forecast
These were the shows that captured our attention and hearts this past year.|Non-Forecast
Underwater I could only pray Jesus Christ help!, Zack, a crew member of the rock band Seventeen, said in an Instagram post describing how he struggled in the water.|Non-Forecast
In fact, lots of parallels can be drawn between Maltas system and other forms of energy storage. |Non-Forecast
Currently, large-scale energy storage is an expensive solution, but ideas like Maltas address a lot of the cost issues, at least on paper.|Non-Forecast
Annual medical expenses nationwide in Japan have passed 40 trillion and are expected to grow faster than the rate of the countrys GDP.|Forecast
And Colorado is again complicit in another attack on the Constitution. |Non-Forecast
GTE was the contest sponsor at that time.|Non-Forecast
As a result of todays global climate change, Antarctica will warm twice as much as the rest of the planet.|Forecast
More broadly, the popular revolt has added an additional headwind to Frances economy.|Non-Forecast
The Carbon Capture and Storage market in the American region is anticipated to grow at a very high pace during the forecast period 2016 to 2021.|Forecast
Chinas integration into the global value chain will increasingly occur in digital spaces.|Forecast
The International Monetary Fund projects a 6 percent expansion on average over the coming five years for China.|Forecast
TTIPs biggest threat to society is its inherent assault on democracy.|Forecast
Hundreds of millions of Americans will work hard and make difficult choices in 2019. |Non-Forecast
Japans populations will continue to decline.|Forecast
HDFC Bank and Housing Development Finance Corp were the biggest contributors to the NSE indexs gains, rising 2.1 per cent and 1.9 per cent higher, respectively.|Non-Forecast
Making the EU rules tighter will drive organisations to seek on-shore repositories for the data identified under any new regulations.|Forecast
On Dec. 15, the 12 researchers who make up New Horizons hazard watch team confirmed that the approach path was safe using New Horizons telescopic Long Range Reconnaissance Imager (LORRI).|Non-Forecast
Legislation will need to change to permit non-line-of-sight drones.|Forecast
Most games did not include built-in benchmarks, which can lead to some variance in test results (though loading-time comparisons are the most consistent data point compared in these tests, since these were measured for identical levels and menus in each game).|Non-Forecast
Liu said in a social media post he felt utter self-admonishment and regret for the enormous pain his actions on that day caused his family, especially his wife, internet celebrity Zhang Zetian.|Non-Forecast
This year the vast archipelago, which sits on the Pacific Ring of Fire, has suffered its worst death toll from disasters in over a decade.|Non-Forecast
Existing and potentially increased state renewable energy standards will continue to drive the need for renewable resources at both the utility and consumer levels.|Forecast
Hong Kong will continue to face fundamental challenges of growing local resistance to central government and antipathy to mainland China among much of the population.|Forecast
Guatemalas foreign ministry has called for an investigation into Felipes death.|Non-Forecast
The Bank of Japan is unlikely to regard near term weakness in the economy as a reason to loosen policy but will wait to see how things look after the EU referendum.|Forecast
An opportunity for Chinese manufacturers to create printers that employ the technology.10 ? Intellectual property enforcement.|Forecast
The EPA and the Transportation Department are near the mid-point of a program expected to raise the average fuel economy of passenger cars to more than 50 miles per gallon by 2025.|Forecast
Social Security, Medicare, and Medicaid. The retirement of the baby boomer generation causes the Social Security and Medicare rolls and costs to swell, while the passage of Obamacare expanded the number of people who receive Medicaid and other health care subsidies.|Non-Forecast
Cognitive banking organizations can provide doorways for existing fintech firms to build relationships with households they could not reach or serve before.|Forecast
A leading Australian intelligence company is selling state-of-the-art surveillance technology to Bahrain amid concerns it could be used to target pro-democracy campaigners.|Forecast
There will probably be greater coordination and concentration of maritime people smuggling networks on the Central Mediterranean route from Libya.|Forecast
When youve chosen a fresh-looking plant, measure the height and width to make sure it will fit into your home. |Non-Forecast
Companies who commit to protect workers in their supply chains will have the potential to act as drivers of sustainable change towards a business model for the eradication of modern slavery, forced labour and human trafficking in global supply chains.|Forecast
Platforms using AI for targeting purposes will account for 74% of total online and mobile advertising spend by 2022.|Forecast
In both political and economic terms, Brexit will constitute an asymmetric shock for Ireland.|Forecast
Behaviors help you differentiate yourself as a high performer because they prove that you can do more than just get things done.|Non-Forecast
Agricultural research spending in Kenya has stagnated and is expected to decline as a result of contractions in government, donor contributions, and commodity taxes.|Forecast
 the shift toward automation that benefits both consumers and retailers, like that used to power Amazons cashier-less grocery store, is inevitable.|Forecast
Companies seemingly will not be searching for a solution in futuristic inventions but by investing in human skills.|Forecast
Russia has interpreted an increase in U.S. missile defense initiatives as a threat.|Forecast
Analytics will allow urban planners to incentivize travel to relieve congestion.|Forecast
By 2021, 40 percent of digital transformation initiatives will use AI services.|Forecast
Trump has come under withering criticism from fellow Republicans, Democrats and international allies over his decision to pull out of Syria because he believed Islamic State militants have been defeated.|Non-Forecast
Spruce needles are short and stiff, and they grow right out of the branch.|Non-Forecast
And indeed, nearly all of those surveyed agreed physical activity is good for health.|Non-Forecast
From our work in many states across the country, we can say without hesitation that these programs restore livesputting people on a new path and eventually reduce crime.|Non-Forecast
Merkel could now face increased calls for tighter border security and greater vetting of arrivals.|Forecast
Connected technologies could allow policyholders and even smart cars and networked homes to diagnose their own problems and report incidents.|Forecast
TTIP such as the Chinese-sponsored Free Trade Area of the Asia Pacific will not have the high standards of TPP.|Forecast
With only a few days of 2018 remaining, some customers still waiting for their vehicles have used social media to complain about the delays and what they called a lack of communication by the company.|Non-Forecast
HMD is my favorite Android OEM, and any time it announces anything, you should be paying attention.|Non-Forecast
As we say goodbye to 2018, let us look back and remember the good timesand the good products. |Non-Forecast
The most visible change in US policy toward China is the existing imposition of tariffs and the threat of more to come.|Non-Forecast
BMI Research forecasts the Indias beef production to hit 5.1 million tonnes by 2020.|Forecast
The global market for commercial drones is projected to grow at a CAGR of over 27% during 2016-2021.|Forecast
However, those left in El Paso seem to have been abandoned with minimal information or resources and many told volunteers they did not even know which city they were in.|Non-Forecast
Strong investor appetites will fuel demand for hotel acquisitions.|Forecast
A key step for international tech openness will be passing the Trans-Pacific Partnership.|Forecast
Shanahan is a former top executive with the defense contractor Boeing, which received $20 billion in contracts from the Pentagon since Shanahan became second in command at the Defense Department.|Non-Forecast
Cloud computing and mobility are expected to sweep over the business landscape and transform the traditional way of doing business. |Forecast
Citibank Korea predicts the economy will grow only 0.1 percent in the fourth quarter.|Forecast
Fixing failing water systems in the U.S. are going to cost $1 trillion over the next 25 years and water utilities are only spending about half of what they should to address the problems.|Forecast
President Donald Trump made a surprise visit to U.S. troops in Iraq on Wednesday  his first trip to a combat zone as Commander in Chief.|Non-Forecast
The film was highly influential with European filmmakers at the time, in large part because director Rene Manzor turned the holy day of Christmas into a violent nightmare scenario, violating a cultural taboo.|Non-Forecast
Between 2007 and 2020, the amount of e-waste exported to India will have jumped by 500 percent.|Forecast
The beauty of a limited government (the way ours was set up) is that it allows the individual to flourish by protecting individual liberty and providing a platform for the individual to succeed.|Non-Forecast
That helped propel Tencents shares up by as much as 4.6 percent, putting the gaming-to-social media giant on course for its steepest daily share price jump in over a month.|Non-Forecast
For the next 10 years networks will be hybrid.|Forecast
Total spending on system hardware (servers and storage) and software (command & control, network infrastructure, and robotics-specific applications) will grow nearly as fast as services spending.|Forecast
Officials are concerned that Saudis could destroy critical infrastructure that would hamper a Yemeni recovery and could make US a war co-belligerent.|Forecast
But with no end in sight to the shutdown, which went into place at midnight Friday, her worries are growing.|Non-Forecast
Microbeads used in bathroom products are expected to be banned by the UK government by the end of next year.|Forecast
A new US visa proposal aimed at luring the best entrepreneurs from around the world could increase Australias brain drain and damage the growth of the ecosystem.|Forecast
The Southern Poverty Law Center has documented growing threats of civil war from white supremacists should Hillary Clinton win.|Forecast
All three of these banks passed the qualitative portion of the test.|Non-Forecast
A slew of analysts have warned bond investors in the coming years will be hit by negative real returns, citing stretched valuations, the prospect of rising price pressures from a low base, and monetary tightening in the U.S.|Forecast
Flash forward to the 2015, a fractured Republican Party in disarray, Ryan changed his mind.|Non-Forecast
Cities around the world will be able to foster greater citizen engagement and increase accountability.|Forecast
The proliferation of mobile technology is helping to drive the growth and globalization of e-commerce.|Forecast
In the US, drivers who purchase a battery electric vehicle qualify for a $7,500 Federal Tax Credit on the purchase of their vehicleunless the automaker has sold more than 200,000 electric vehicles.|Non-Forecast
Indonesia will need Rp 5.5 quadrillion for its infrastructure projects from 2014 to 2019.|Forecast
Aquaculture will overtake capture fisheries in 2021 and reach 52% of total fish production in 2025.|Forecast
The International Monetary Fund recently trimmed back its 2016 global growth forecast to 3.1 percent.|Forecast
